{"$id":"QK_GBFP8_HEAD64_GRANULARITY_SWEEP_EXECUTION_V8_SHELLFREE_FRESH_L2_ACCEPTANCE_SCHEMA","$schema":"https://json-schema.org/draft/2020-12/schema","additionalProperties":false,"properties":{"acceptance_sha256":{"pattern":"^[0-9a-f]{64}$","type":"string"},"action_id":{"const":"ace2:qk-gbfp8-base-v8:execute-once:2254dd91:20260813T1724Z"},"artifact_kind":{"const":"qk_gbfp8_head64_granularity_sweep_execution_v8_shellfree_fresh_l2_static_acceptance"},"decision":{"const":"ACCEPT_STATIC_PACKAGE"},"execution_package_file_sha256":{"pattern":"^[0-9a-f]{64}$","type":"string"},"reviewer_role":{"const":"Fresh-L2"},"static_acceptance_grants_execution_authority":{"const":false}},"required":["acceptance_sha256","action_id","artifact_kind","decision","execution_package_file_sha256","reviewer_role","static_acceptance_grants_execution_authority"],"type":"object"}
