{"acceptance_sha256":"2f1f08c78c542345a077b0d22a1f6bd95dc785f25a7fdfda74236d0cc1615cd0","action_id":"ace2:qk-gbfp8-base-v8:execute-once:2254dd91:20260813T1724Z","artifact_kind":"qk_gbfp8_head64_granularity_sweep_execution_v8_shellfree_fresh_l2_static_acceptance","decision":"ACCEPT_STATIC_PACKAGE","execution_package_file_sha256":"3cbe1395186c013ed75f706ff43a2847f4a3cc1b8e464fbcdc038db4919674a8","reviewer_role":"Fresh-L2","static_acceptance_grants_execution_authority":false}
